{
  "internal_id": "inv-andaman-hydrocarbon-discovery-2026",
  "metadata": {
    "author": "Factline Report Generation Agent",
    "tags": [
      "Energy Security",
      "Geopolitics",
      "Oil & Gas Exploration",
      "Misinformation",
      "Environmental Impact"
    ],
    "cover_image": "/data/assets/andaman-hydrocarbon-discovery/cover_image.png",
    "theme_color": "#D35400"
  },
  "public": {
    "id": "andaman-hydrocarbon-discovery",
    "slug": "andaman-hydrocarbon-discovery",
    "title": "The Flame: What India Actually Found in the Andaman Sea",
    "summary": "In June 2026, the internet erupted with claims that India had discovered a massive, ready-to-extract natural gas reserve in the Andaman Sea. An exhaustive investigation into the geological data and corporate disclosures reveals a different reality: India has not quantified a commercially viable reserve. Instead, they discovered something far more important to scientists\u2014a continuous methane flare that physically proves a highly active petroleum system exists in a deepwater frontier. The true story isn't about an instant economic windfall, but a multi-billion-dollar scientific validation that will take decades to monetize.",
    "verdict": "Missing Context",
    "published_at": "2026-06-14T14:00:00+05:30",
    "public_url": "https://factline.com/investigations/andaman-hydrocarbon-discovery"
  },
  "candidate": {
    "url": "https://www.youtube.com/watch?v=G4Z81lcNz2U",
    "title": "India Discovers Natural Gas in Andaman Sea, Major Offshore Find Confirmed",
    "source_name": "News18 / Viral Social Media Consensus",
    "screenshot_path": "/data/assets/andaman-hydrocarbon-discovery/news18.jpeg"
  },
  "claims": [
    {
      "claim_text": "India has discovered a fully quantified, massive natural gas reservoir in the Andaman Sea that is ready for immediate extraction to slash LNG import bills.",
      "claim_status": "False",
      "confidence_score": 98,
      "evidence": [
        {
          "url": "https://geoexpro.com/india-andaman-islands-drilling-update/",
          "extracted_text": "While hydrocarbons were successfully intercepted, the actual reserve size is completely unknown. Following the initial discovery, engineers must process 600 square kilometers of new high-resolution 3D seismic data. Until this mapping is complete, and further appraisal wells are drilled to locate the physical edges of the reservoir, the total extractable volume cannot be calculated.",
          "source_score": 95,
          "source_type": "Geological Industry Journal",
          "screenshot_path": "/data/assets/andaman-hydrocarbon-discovery/geoexpro.png"
        },
        {
          "url": "https://www.spglobal.com/discovery-to-production-averages-15-7-years",
          "extracted_text": "The interval from a deepwater discovery to first commercial production averages 10 to 15 years globally. Complex subsea engineering, Final Investment Decisions (FID), and massive infrastructure construction place any potential 'first gas' delivery well into the late 2030s.",
          "source_score": 98,
          "source_type": "Global Energy Analytics Report"
        }
      ],
      "contradicting_evidence": [
        {
          "url": "https://www.reddit.com/r/IndianStreetBets/comments/1ns19vz/ocean_of_opportunities_india_confirms_natural_gas/",
          "extracted_text": "This is our Guyana moment. We are sitting on trillions of cubic feet of gas that will wipe out our $15B import bill this year. ONGC and OIL to the moon.",
          "source_score": 20,
          "source_type": "Retail Investor Forum"
        }
      ]
    },
    {
      "claim_text": "The continuous flaring at the Sri Vijayapuram-3 well provides undeniable physical proof of a highly pressurized, active working petroleum system beneath the Andaman microplate.",
      "claim_status": "Verified",
      "confidence_score": 99,
      "evidence": [
        {
          "url": "https://economictimes.indiatimes.com/industry/energy/oil-gas/india-witnesses-renewed-spurt-in-oil-and-gas-exploration-petroleum-minister-puri/articleshow/122978209.cms",
          "extracted_text": "Upon perforation, the Sri Vijayapuram-3 well exhibited an immediate pressure build-up, pushing gas to the surface naturally without mechanical assistance. This continuous flaring of 87% pure methane confirms that all four necessary elements\u2014source rock, reservoir, migration pathway, and trap\u2014exist and interact successfully.",
          "source_score": 98,
          "source_type": "Official Government Press Release",
          "screenshot_path": "/data/assets/andaman-hydrocarbon-discovery/pib.avif"
        },
        {
          "url": "https://www.frontiersin.org/journals/earth-science/articles/10.3389/feart.2024.1334942/full",
          "extracted_text": "The Andaman Sea sits in a back-arc basin geologically connected to highly productive systems. A continuous flare acts as a vital calibration point, de-risking the basin by proving the geological theory in a physical setting.",
          "source_score": 92,
          "source_type": "Scientific Geological Publication",
          "screenshot_path": "/data/assets/andaman-hydrocarbon-discovery/frontiersin.webp"
        }
      ],
      "contradicting_evidence": []
    },
    {
      "claim_text": "National oil exploration companies like ONGC and Oil India will immediately reap massive financial profits from the Andaman drilling campaign.",
      "claim_status": "Mostly False",
      "confidence_score": 95,
      "evidence": [
        {
          "url": "https://drillingcontractor.org/dolphin-drilling-wins-120-day-extension-for-blackford-dolphin-76091",
          "extracted_text": "Exploration companies bleed cash during the appraisal phase. The true immediate financial beneficiaries are the offshore service and logistics companies. Rig operators like Dolphin Drilling are locking in multi-million dollar contract extensions regardless of whether the specific wells hit commercial gas or come up dry.",
          "source_score": 94,
          "source_type": "Offshore Industry Publication",
          "screenshot_path": "/data/assets/andaman-hydrocarbon-discovery/drilling.jpg"
        },
        {
          "url": "https://newsonprojects.com/news/deep-industries-ltd-secures-59-crore-loa-from-ongc",
          "extracted_text": "Service providers like Deep Industries are reporting massive free cash flow driven by a surge in PSU offshore contracts related to the 'Samudra Manthan' exploration cycles.",
          "source_score": 90,
          "source_type": "Financial Projects Database"
        }
      ],
      "contradicting_evidence": []
    }
  ],
  "dashboard": {
    "hero_title": "The Flame: Decoding India's $5 Billion Deepwater Gamble",
    "hero_summary": "When India announced a natural gas discovery off the Andaman Islands, the public celebrated an instant end to imported oil. But Factline's deep dive reveals a striking divide between internet hype and petroleum science. India hasn't found a 'gas tank'\u2014they found the recipe. A single, continuous methane flare burning above the ocean has finally proven the existence of a working petroleum system in a high-risk maritime frontier. The gas is there, but monetizing it will require a multi-decade, $5 billion engineering marathon traversing tectonic fault lines and fragile indigenous ecosystems.",
    "why_people_care": "India is trapped by its geography. As the world's third-largest energy consumer, it imports 85-88% of its crude oil and over 50% of its natural gas. With mature domestic fields like Bombay High in a state of terminal decline, the nation's economic engine is entirely dependent on volatile Middle Eastern politics and global LNG prices. The Andaman discovery represents a psychological and strategic victory for the 'Samudra Manthan' mission, offering hope for energy sovereignty while projecting hard maritime power near the critical Malacca Strait.",
    "what_we_found": "Our investigation strips away the financial speculation to focus on the science of the seabed. The breakthrough was achieved by Oil India's Sri Vijayapuram-3 well, which was drilled into the Eocene formation. By achieving a continuous flare of 87% methane, geologists received physical proof that four crucial elements\u2014source rock, reservoir, migration pathways, and a trap\u2014exist and function together. However, the volume is entirely unquantified. \n\nBehind the scenes, ONGC is drilling massive 'stratigraphic' wells (AND-P-1) nearly 267 nautical miles offshore\u2014not to extract gas, but to harvest core samples to convince international oil majors that the basin is safe for investment. The logistics of actually using this gas are nightmarish. Because the islands are 1,200 kilometers from mainland industrial hubs, India must either build a massively expensive $5 billion subsea pipeline across an active earthquake subduction zone, or rely on complex Floating LNG vessels. Furthermore, any onshore industrialization threatens the fragile ecosystem of the isolated Jarawa tribe.",
    "key_takeaways": [
      "Proof of Concept: The discovery validates the back-arc basin theory. Finding a continuous flare acts as the ultimate de-risking event for thousands of square kilometers of surrounding ocean.",
      "The Isotope Question: Scientists are currently analyzing the gas to see if it is biogenic (shallow, localized pockets) or thermogenic (deep-cooked, signaling a world-class mega-reserve).",
      "Shovel Sellers Win First: The companies making instant profit aren't the oil giants\u2014they are offshore logistics and rig operators securing guaranteed government exploration contracts.",
      "The 1,200km Pipeline Nightmare: Transporting the gas to Chennai will require unprecedented engineering to navigate deep ocean trenches and pulse-like ground motions from tectonic activity.",